#,tweet_id,evidence_url,claim_reviewed,indian
12542,1348503935305230080,https://www.snopes.com/fact-check/boebert-tweet-pelosi-location/,"Republican congresswoman Lauren Boebert tweeted about House Speaker Nancy Pelosi's whereabouts during the Jan. 6, 2021 Capitol riot.",0
12546,1349805356545959936,https://www.snopes.com/fact-check/trump-carved-manatees-back/,An endangered Florida manatee was discovered with the word “Trump” carved into its back.,0
12547,1348814786461580032,https://www.snopes.com/fact-check/trump-carved-manatees-back/,An endangered Florida manatee was discovered with the word “Trump” carved into its back.,0
12552,1349102753461710080,https://www.snopes.com/fact-check/chuck-norris-capitol-riot/,"A photograph shows actor Chuck Norris at a rally before the U.S. Capitol riot on Jan. 6, 2021.",0
12573,1349800578155770112,https://www.snopes.com/fact-check/lauren-boebert-capitol-steps/,A photograph shows U.S. Rep. Lauren Boebert with a group of insurrectionists on the steps of the U.S. Capitol the day before the Jan. 6 riot.,0
12670,1350101018416179968,https://www.snopes.com/fact-check/trump-martial-law-imminent/,"Credible sources said U.S. President Donald Trump was preparing to invoke martial law before President-elect Joe Biden's inauguration on Jan. 20, 2021.",0
12672,1357429305886840064,https://www.snopes.com/fact-check/pressley-panic-buttons/,"Emergency panic buttons were inexplicably removed from U.S. Rep. Ayanna Pressley's Capitol suite before the Jan. 6 insurrection, possibly as part of a conspiracy against her.",0
12673,1356645792228940032,https://www.snopes.com/fact-check/pressley-panic-buttons/,"Emergency panic buttons were inexplicably removed from U.S. Rep. Ayanna Pressley's Capitol suite before the Jan. 6 insurrection, possibly as part of a conspiracy against her.",0
12678,1356874429888930048,https://www.snopes.com/fact-check/pressley-panic-buttons/,"Emergency panic buttons were inexplicably removed from U.S. Rep. Ayanna Pressley's Capitol suite before the Jan. 6 insurrection, possibly as part of a conspiracy against her.",0
12680,1361126775879660032,https://www.snopes.com/fact-check/pressley-panic-buttons/,"Emergency panic buttons were inexplicably removed from U.S. Rep. Ayanna Pressley's Capitol suite before the Jan. 6 insurrection, possibly as part of a conspiracy against her.",0
12842,1352253588974739968,https://www.snopes.com/fact-check/national-guard-biden-motorcade/,A video shows members of the National Guard turning their backs on U.S. President Joe Biden's motorcade.,0
12844,1352490966100410112,https://www.snopes.com/fact-check/national-guard-biden-motorcade/,A video shows members of the National Guard turning their backs on U.S. President Joe Biden's motorcade.,0
12846,1352634847165029888,https://www.snopes.com/fact-check/national-guard-biden-motorcade/,A video shows members of the National Guard turning their backs on U.S. President Joe Biden's motorcade.,0
12848,1352620841285149952,https://www.snopes.com/fact-check/national-guard-biden-motorcade/,A video shows members of the National Guard turning their backs on U.S. President Joe Biden's motorcade.,0
12850,1352067985855429888,https://www.snopes.com/fact-check/national-guard-biden-motorcade/,A video shows members of the National Guard turning their backs on U.S. President Joe Biden's motorcade.,0
12851,1352461749568600064,https://www.snopes.com/fact-check/national-guard-biden-motorcade/,A video shows members of the National Guard turning their backs on U.S. President Joe Biden's motorcade.,0
12922,1352634650125090048,https://www.snopes.com/fact-check/kamala-harris-planned-parenthood/,"Kamala Harris declined to prosecute Planned Parenthood for selling aborted baby parts, but prosecuted the journalists who exposed that crime.",0
13011,1354195687009890048,https://www.snopes.com/fact-check/bear-skier-chase-mountain/,A video shows a bear chasing a skier down a mountain in Romania in January 2021.,0
13050,1355135536927749888,https://www.snopes.com/fact-check/biden-bans-china-virus/,U.S. President Joe Biden issued an executive order in January 2021 banning any use of the term “China virus.”,0
13344,1359112616640090112,https://www.snopes.com/fact-check/trump-impeachment-air-force-one/,"Former U.S. President Donald Trump said that he would testify during his second impeachment trial if could to travel to Washington, D.C., on Air Force One.",0
13823,1419294524803849984,https://www.indiatoday.in/fact-check/story/wrestler-priya-malik-has-won-gold-medal-but-not-at-tokyo-olympics-1832437-2021-07-25,India wins gold at Tokyo Olympics. Priya Malik wins the first gold medal in wrestling.,1
13826,1419271199058670080,https://www.indiatoday.in/fact-check/story/wrestler-priya-malik-has-won-gold-medal-but-not-at-tokyo-olympics-1832437-2021-07-25,India wins gold at Tokyo Olympics. Priya Malik wins the first gold medal in wrestling.,1
13860,1427464534919360000,https://www.indiatoday.in/fact-check/story/fact-check-old-video-from-syria-shared-as-taliban-executing-woman-in-afghanistan-1842439-2021-08-18,"Video shows a woman being shot in the head by Taliban in Afghanistan for not dressing ""appropriately"".
",1
13888,1427238729005949952,https://www.factchecker.in/fact-check/factcheck-have-fuel-prices-increased-due-to-oil-bonds-issued-by-upa-756951,Hike in fuel prices because of oil bonds issued by United Progressive Alliance (UPA) government,1
14022,1392147851199800064,https://www.thequint.com/news/webqoof/old-video-from-jordan-passed-off-as-palestinians-faking-casualties,Video of Palestinians faking casualties amid the ongoing conflict with Israel,1
14120,1407022882270579968,https://www.indiatoday.in/fact-check/story/fact-check-facebook-post-gone-viral-falsely-claiming-top-us-physician-dr-fauci-is-sacked-1817741-2021-06-22,"Dr Anthony Fauci, America’s top infectious diseases expert and chief medical adviser to the US President, has been sacked. The US has now admitted that coronavirus was man-made.",1
14143,1416906841276169984,https://newsmobile.in/articles/2021/05/22/fact-check-fake-message-viral-as-phones-being-hacked-by-coronavirus-vaccine-inquiry-number/,Answering call from ‘912250041117’ will hack phone,1
14300,1447593167532950016,https://www.indiatoday.in/fact-check/story/fact-check-not-king-bahrain-in-dubai-automaton-bodyguard-1712063-2020-08-17,Video shows King of Bahrain arriving in Dubai with his robot bodyguard.,1
14389,1433086136662980096,https://www.thequint.com/news/webqoof/afghans-crossing-pakistan-border-in-2020-shared-now-with-misleading-context-fact-check,People entering Pakistan fleeing from Afghanistan. ,1
14406,1436531078127180032,https://www.indiatoday.in/fact-check/story/fact-check-video-from-feature-film-viral-as-taliban-detaining-afghan-citizens-1851784-2021-09-11,Video shows Taliban detaining and pushing Kabul and Panjshir residents in truck container.,1
14513,1459074204049939968,https://newschecker.in/fact-check/did-rashid-alvi-say-those-saying-jai-shri-ram-are-demons-viral-clip-shared-with-missing-context,Rashid Alvi said those who say Jai Shri Ram are demons,1
14589,1464890735577080064,https://www.indiatoday.in/fact-check/story/video-of-temple-demolition-in-karnataka-passed-off-as-from-tamil-nadu-1852861-2021-09-15,Video shows a temple being demolished in Tamil Nadu.,1
14591,1466328587590530048,https://www.indiatoday.in/fact-check/story/fact-check-will-tata-group-not-hire-from-jnu-anymore-1639916-2020-01-24,Tata Group will no longer hire students from JNU,1
14595,1468062412012019968,https://www.indiatoday.in/fact-check/story/fact-check-1966-incident-police-firing-sadhus-goes-viral-with-exaggerated-claims-1884800-2021-12-06,"On November 7, 1966, hundreds of sadhus and gau rakshaks, who were part of the anti-cow slaughter agitation, were killed in police firing in Delhi at the behest of the Indira Gandhi government. ",1
14597,1468557505592649984,https://newsmobile.in/articles/2021/12/10/fact-check-no-this-video-footage-is-not-of-the-chopper-crash-which-claimed-cds-gen-rawats-life/,Video shows the crash of Mi-17V5 helicopter in Tamil Nadu that was carrying Chief of Defence Staff Gen Bipin Rawat,1
14602,1468605860624669952,https://newschecker.in/fact-check/video-of-syrian-helicopter-shot-down-in-idlib-shared-as-footage-of-gen-bipin-rawats-chopper-crash,Video shows Gen Bipin Rawat's chopper crash in Tamil Nadu,1
14603,1468547484683160064,https://newschecker.in/fact-check/video-of-syrian-helicopter-shot-down-in-idlib-shared-as-footage-of-gen-bipin-rawats-chopper-crash,Video shows Gen Bipin Rawat's chopper crash in Tamil Nadu,1
14612,1469701458773769984,https://www.thequint.com/news/webqoof/2017-video-shared-as-recent-attack-on-up-cm-yogi-adityanath-convoy-factcheck,Video shows Uttar Pradesh Chief Minister Yogi Adityanath's convoy was attacked recently.,1
14613,1469646806136940032,https://www.thequint.com/news/webqoof/2017-video-shared-as-recent-attack-on-up-cm-yogi-adityanath-convoy-factcheck,Video shows Uttar Pradesh Chief Minister Yogi Adityanath's convoy was attacked recently.,1
14614,1469592159422589952,https://www.thequint.com/news/webqoof/2017-video-shared-as-recent-attack-on-up-cm-yogi-adityanath-convoy-factcheck,Video shows Uttar Pradesh Chief Minister Yogi Adityanath's convoy was attacked recently.,1
14628,1475419018441880064,https://www.thequint.com/news/webqoof/ttd-trust-board-member-j-sekhar-reddy-gold-recovery-fact-check,Photographs show recent raid on J Sekhar Reddy by IT officers and the gold recovered.,1
14643,1502632510312029952,https://www.altnews.in/were-modi-modi-slogans-raised-in-pakistan-parliament-india-tv-tv9-bharatvarsh-misreport/,'Modi Modi' slogans raised in Pakistani parliament,1
14649,1483800456585309952,https://www.altnews.in/clipped-video-barkha-dutts-2004-report-on-plight-of-kashmiri-pandits-viral-as-justifying-their-massacre/,Barkha Dutt justified massacre of Pandits in Kashmir in NDTV report,1
14722,1494919292030109952,https://www.altnews.in/media-falsely-reports-ramayana-mahabharata-to-be-taught-in-saudi-arabian-schools/,Ramayana and Mahabharata will be taught in Saudi Arabia,1
14729,1489818560620740096,https://www.altnews.in/did-lack-of-financial-support-by-nehru-govt-force-indian-football-team-to-play-barefoot-in-1948-olympics/,Lack of financial support by Nehru govt forced Indian football team to play barefoot at 1948 olympics,1
14814,1481864442011069952,https://www.altnews.in/video-of-brothers-reuniting-74-years-after-india-pak-partition-shared-with-false-claim/,"Sikh brothers reunited after partition, the one from Pakistan had to convert to Islam",1
14867,1489020987278459904,https://www.altnews.in/video-from-thane-falsely-viral-as-muslim-woman-preventing-flag-hoisting-on-r-day/,Muslim woman in Maharashtra blocking flag hoisting and snatching Bharat Mata's photo on Republic Day,1
14870,1488468114681430016,https://www.altnews.in/video-from-thane-falsely-viral-as-muslim-woman-preventing-flag-hoisting-on-r-day/,Muslim woman in Maharashtra blocking flag hoisting and snatching Bharat Mata's photo on Republic Day,1
14871,1488352226066109952,https://www.altnews.in/video-from-thane-falsely-viral-as-muslim-woman-preventing-flag-hoisting-on-r-day/,Muslim woman in Maharashtra blocking flag hoisting and snatching Bharat Mata's photo on Republic Day,1
14875,1489105250502180096,https://www.altnews.in/video-from-thane-falsely-viral-as-muslim-woman-preventing-flag-hoisting-on-r-day/,Muslim woman in Maharashtra blocking flag hoisting and snatching Bharat Mata's photo on Republic Day,1
14876,1488830808362080000,https://www.altnews.in/video-from-thane-falsely-viral-as-muslim-woman-preventing-flag-hoisting-on-r-day/,Muslim woman in Maharashtra blocking flag hoisting and snatching Bharat Mata's photo on Republic Day,1
14920,1491010539690259968,https://www.boomlive.in/fact-check/politics/karnataka-national-flag-replaced-with-saffron-flag-replaces-indian-flag-shivamogga-karnataka-hijab-row-factcheck-16683,"Video shows National flag being replaced with saffron flag in Shivamogga, Karnataka",1
15395,1486393794908290048,https://www.altnews.in/did-tmc-members-unfurl-party-flag-while-singing-national-anthem-on-r-day-no-cropped-video-viral/,AITC leader Purna Chandra Bauri and others hoisted TMC flag while singing national anthem,1
15526,1493530877305189888,https://www.altnews.in/hijab-row-bjp-leaders-falsely-claim-bombs-hurled-at-murshidabad-school-during-protest/,Bombs hurled at school over Hijab ban in the Murshidabad distrcit of West Bengal,1
15527,1493533215025349888,https://www.altnews.in/hijab-row-bjp-leaders-falsely-claim-bombs-hurled-at-murshidabad-school-during-protest/,Bombs hurled at school over Hijab ban in the Murshidabad distrcit of West Bengal,1
15551,1496289547059340032,https://www.altnews.in/no-hanuman-temple-wasnt-attacked-during-communal-clash-in-telanganas-karmanghat/,Muslims attacked Karmanghat Hanuman temple,1
15624,1502612434070089984,https://www.boomlive.in/fact-check/politics/fake-message-claims-bjp-won-165-seats-in-up-with-fewer-than-2000-votes-17158,"BjP won 7 seats by 200 votes, 23 seats by 500 votes, 49 seats by 1000 votes and   86 by 2000 votes",1
15649,1505129069687439872,https://www.altnews.in/video-of-karnataka-hc-reprimanding-a-lawyer-is-not-related-to-the-hijab-row/,Karnataka HC suspended the license of the lawyer representing the petitioners over Hijab ban,1
15750,1507820445755940096,https://www.altnews.in/no-this-isnt-tn-man-arrested-for-issuing-death-threats-to-karnataka-judges/,Clip of person who gave death threat to Karnataka High Court judges for hijab verdict,1
15868,1482731101450020096,https://www.indiatoday.in/fact-check/story/coca-cola-first-year-sales-bottles-glasses-post-viral-1616800-2019-11-07,Coca-Cola sold just 25 bottles in its first year.,1
15903,1487441329441609984,https://www.indiatoday.in/fact-check/story/fact-check-not-king-bahrain-in-dubai-automaton-bodyguard-1712063-2020-08-17,Video shows King of Bahrain arriving in Dubai with his robot bodyguard.,1
15943,1501717918048039936,https://www.indiatoday.in/fact-check/story/fact-check-conspiracy-theory-falsely-accuses-pharma-company-behind-covid-outbreak-and-vaccine-1802143-2021-05-13,"The Chinese laboratory in Wuhan where coronavirus emerged is owned by GlaxoSmithKline (GSK). The same GSK also owns Pfizer, the pharma company that produces vaccine for the virus. ",1
15995,1487460801808009984,https://newschecker.in/fact-check/was-imran-khan-expelled-from-oic-for-speaking-against-ram-temple,Imran Khan Expelled From Conference Of Islamic Countries For Speaking Against Ram Temple,1
16037,1494420207351529984,https://www.indiatoday.in/fact-check/story/fact-check-forged-letter-claims-pro-khalistan-sikhs-for-justice-supports-aap-in-punjab-polls-1914861-2022-02-18,This letter proves that the pro-Khalistan organisation Sikhs For Justice supports Aam Admi Party in the Punjab Elections. ,1
16057,1496724250023010048,https://newschecker.in/fact-check/news/fighter-jets-flying-over-ukraine,Video shows Russian fighter jets flying over Ukraine,1
16061,1496758555935790080,https://newschecker.in/fact-check/news/fighter-jets-flying-over-ukraine,Video shows Russian fighter jets flying over Ukraine,1
16065,1496724320567049984,https://newschecker.in/fact-check/news/fighter-jets-flying-over-ukraine,Video shows Russian fighter jets flying over Ukraine,1
16069,1496874317199589888,https://newschecker.in/fact-check/news/video-of-libyan-rebels-shooting-down-plane-from-2011-shared-in-context-of-russia-ukraine-conflict,Video shows Russian fighter jet being shot down by Ukraine forces,1
16249,1500741140261189888,https://newsmobile.in/articles/2022/03/07/fact-check-does-the-viral-video-show-fake-dead-bodies-of-ukrainians/,The viral video of moving corpse shows a media report about the Russia-Ukraine war,1
16281,1505876387042929920,https://www.indiatoday.in/fact-check/story/fact-check-simulated-video-ethiopian-plane-chinese-boeing-737-crash-1927826-2022-03-21,Final moments recorded on a Boeing 737 that crashed in southern China with 133 passengers and crew on board.,1
16305,1067390566759990016,https://www.altnews.in/bjp-it-cell-head-amit-malviya-shares-mischievously-clipped-video-of-manmohan-singh/,"Dr Manmohan Singh contradicted Rahul Gandhi, praised MP and Chhattisgarh state govts",1
16308,1067378245287490048,https://www.altnews.in/bjp-it-cell-head-amit-malviya-shares-mischievously-clipped-video-of-manmohan-singh/,"Dr Manmohan Singh contradicted Rahul Gandhi, praised MP and Chhattisgarh state govts",1
16318,1038267406865650048,https://www.altnews.in/no-adolf-hitler-had-not-said-burn-me-alive-if-i-am-wrong-in-1936-speech-at-essen/,"Hitler in a speech in 1936 said, ""Burn me alive if I am wrong""",1
16415,1028918815177020032,https://www.altnews.in/rss-workers-aid-gujarat-flood-shared-as-kerala/,RSS workers giving aid during Kerala floods,1
16465,1064222686325469952,https://www.altnews.in/shehla-rashid-pocketing-money-crowdfunded-for-kathua-unnao-victims-family-is-fake-news/,Shehla Rashid siphoned off money crowdfunded for Kathua/Unnao victims,1
16477,1046020170697920000,https://www.altnews.in/is-sonia-gandhi-the-4th-richest-woman-in-the-world-as-claimed-by-viral-social-media-posts/,Sonia Gandhi fourth richest in the world,1
16483,1063297587078489984,https://www.boomlive.in/janam-tv-peddles-fake-news-of-trupti-desai-converting-to-christianity/,Trupti Desai Converted To Christianity,1
16484,1064367847625779968,https://www.boomlive.in/janam-tv-peddles-fake-news-of-trupti-desai-converting-to-christianity/,Trupti Desai Converted To Christianity,1
16611,1064052554735190016,https://www.boomlive.in/have-upa-era-oil-bonds-prevented-modi-govt-from-reducing-oil-prices/,Modi Govt Has Paid Back UPA-era Oil Bonds Of Rs 1.3 Lakh Crore,1
16648,1016738526510060032,https://www.altnews.in/no-mumbai-airport-is-not-flooded-old-video-from-mexico-shared-on-social-media/,Mumbai/ Hyderabad airport flooded due to heavy rain,1
16666,1003961869793549952,https://www.altnews.in/no-ashok-gehlot-did-not-say-that-generating-electricity-will-remove-energy-from-water/,Ashok Gehlot: Generating electricity will remove energy from water,1
16685,1004017925244649984,https://www.altnews.in/no-ashok-gehlot-did-not-say-that-generating-electricity-will-remove-energy-from-water/,Ashok Gehlot: Generating electricity will remove energy from water,1
16748,1078909444929379968,https://www.altnews.in/pm-modi-makes-false-claim-of-karnataka-government-waiving-loans-of-only-800-farmers/,Karnataka Govt waived loans of only 800 farmers,1
16931,1051669463311949952,https://www.altnews.in/no-rice-for-oil-agreement-between-india-and-iran-is-not-a-modi-govt-initiative/,Rice-for-oil agreement with Iran is a unique initiative by Modi Government,1
17119,1018321343815619968,https://www.altnews.in/disaster-relief-helicopters-uttarakhand-ani/,Passengers in Uttarkhand to be charged for rescue operations,1
17157,1033365358504099968,https://www.altnews.in/did-arnab-goswami-call-the-people-of-kerala-shameless/,Arnab Goswami calls Keralites shamless,1
17201,985716702741778048,https://www.altnews.in/old-news-of-14-year-old-raped-inside-mosque-in-moradabad-circulates-as-recent-incident/,14-year old raped inside mosque in Moradabad,1
17234,988114737358692992,https://www.altnews.in/viral-fake-news-about-student-leader-kanhaiya-kumar-having-failed-for-11th-time/,Kanhaiya Kumar failed for 11th time in JNU exam,1
17300,1001723219076880000,https://www.altnews.in/ten-year-old-video-circulates-as-raid-on-tn-church-involved-in-tuticorin-riots/,Church in Tamil Nadu involved in Tuticorin riots,1
17689,1214213502556080128,https://www.indiatoday.in/fact-check/story/fact-check-is-this-the-video-of-us-drone-strike-that-killed-iranian-general-soleimani-1634526-2020-01-06,Video is of drone attack that killed top Iranian general Qassem Soleimani,1
17725,1240690546386959872,https://www.indiatoday.in/fact-check/story/donald-trump-coronavirus-vaccine-ready-use-roche-1656674-2020-03-18,Donald Trump announced that Roche will launch a vaccine for coronavirus next Sunday.,1
17812,1245718935250409984,https://www.indiatoday.in/fact-check/story/fact-check-are-coronavirus-tests-most-expensive-in-india-1659724-2020-03-25,"While coronavirus tests in other countries are conducted for free or at nominal charges, in India, it costs Rs 4,500
",1
17814,1242443159742769920,https://www.indiatoday.in/fact-check/story/fact-check-are-coronavirus-tests-most-expensive-in-india-1659724-2020-03-25,"While coronavirus tests in other countries are conducted for free or at nominal charges, in India, it costs Rs 4,500
",1
17864,1246894269174109952,https://www.indiatoday.in/fact-check/story/truth-coronavirus-conspiracy-theory-behind-arrest-harvard-professor-1663659-2020-04-05,"Dr. Charles Lieber, a Harvard professor, was arrested for creating coronavirus and selling it to China.",1
17866,1246505891911930112,https://www.indiatoday.in/fact-check/story/truth-coronavirus-conspiracy-theory-behind-arrest-harvard-professor-1663659-2020-04-05,"Dr. Charles Lieber, a Harvard professor, was arrested for creating coronavirus and selling it to China.",1
17896,1257986861244519936,https://www.indiatoday.in/fact-check/story/fact-check-why-were-these-bank-employees-being-transferred-to-an-ambulance-1673882-2020-05-03,All employees of a Punjab National Bank branch at Ghaziabad’s Loni have been found corona positive.,1
17948,1264217905585179904,https://www.indiatoday.in/fact-check/story/fact-check-video-of-woman-being-thrashed-brutally-goes-viral-with-communal-twist-1681475-2020-05-24,Video of Muslim woman being brutally beaten up in India.,1
17985,1336616581707739904,https://www.indiatoday.in/fact-check/story/coca-cola-first-year-sales-bottles-glasses-post-viral-1616800-2019-11-07,Coca-Cola sold just 25 bottles in its first year.,1
17988,1254382006336719872,https://www.indiatoday.in/fact-check/story/coca-cola-first-year-sales-bottles-glasses-post-viral-1616800-2019-11-07,Coca-Cola sold just 25 bottles in its first year.,1
18181,1294877493342739968,https://www.indiatoday.in/fact-check/story/fact-check-not-king-bahrain-in-dubai-automaton-bodyguard-1712063-2020-08-17,Video shows King of Bahrain arriving in Dubai with his robot bodyguard.,1
18182,1294198786609349888,https://www.indiatoday.in/fact-check/story/fact-check-not-king-bahrain-in-dubai-automaton-bodyguard-1712063-2020-08-17,Video shows King of Bahrain arriving in Dubai with his robot bodyguard.,1
18188,1295239487103040000,https://www.indiatoday.in/fact-check/story/fact-check-not-king-bahrain-in-dubai-automaton-bodyguard-1712063-2020-08-17,Video shows King of Bahrain arriving in Dubai with his robot bodyguard.,1
18293,1315297697243549952,https://www.thequint.com/news/webqoof/years-old-image-of-pigeon-on-hospital-patient-fact-check,Pigeon visited lonely patient in hospital,1
18332,1251420748281009920,https://www.indiatoday.in/fact-check/story/fact-check-this-is-not-bruce-lee-playing-ping-pong-with-nunchaku-1616947-2019-11-08,"Rare clip of Bruce Lee playing ping-pong with Nunchaku
",1
18373,1222231605692879872,https://www.indiatoday.in/fact-check/story/fact-check-bangladeshi-woman-s-viral-video-is-not-of-religious-conversion-but-exorcism-1440545-2019-01-27,A Hindu woman in Bangladesh is being converted to Islam,1
18412,1216021466489260032,https://www.indiatoday.in/fact-check/story/not-made-in-india-train-transported-australia-1572715-2019-07-23,This is the video of ‘Made in India’ double-decker metro train coaches in Australia.,1
18453,1243902977716290048,https://www.indiatoday.in/fact-check/story/fact-check-no-putin-has-not-unleashed-lions-on-russian-streets-to-enforce-corona-lockdown-1658566-2020-03-23,"Lions released on Russian streets by Vladimir Putin to force people inside
",1
18498,1248559923878710016,https://www.indiatoday.in/fact-check/story/fact-check-can-kalonji-seeds-cure-covid-19-truth-behind-viral-myth-busted-1665269-2020-04-10,"Kalonji or Nigella Sativa seeds have 100 per cent hydroxychloroquine, and its consumption with honey can prevent coronavirus.",1
18539,1255819199504509952,https://www.indiatoday.in/fact-check/story/fact-check-popular-bakery-in-mumbai-finds-itself-in-the-middle-of-coronavirus-rumours-1672971-2020-04-30,Mumbai’s popular Wibs bread company has been sealed after its workers tested positive for coronavirus. People should not consume their bread.,1
18540,1255776369553799936,https://www.indiatoday.in/fact-check/story/fact-check-popular-bakery-in-mumbai-finds-itself-in-the-middle-of-coronavirus-rumours-1672971-2020-04-30,Mumbai’s popular Wibs bread company has been sealed after its workers tested positive for coronavirus. People should not consume their bread.,1
18542,1255902513825370112,https://www.indiatoday.in/fact-check/story/fact-check-popular-bakery-in-mumbai-finds-itself-in-the-middle-of-coronavirus-rumours-1672971-2020-04-30,Mumbai’s popular Wibs bread company has been sealed after its workers tested positive for coronavirus. People should not consume their bread.,1
18563,1259138729547099904,https://www.thequint.com/news/webqoof/loni-ghaziabad-pnb-employees-test-positive-for-coronavirus-video-taken-out-of-context-fact-check,All employees of Punjab National Bank in Loni in Ghaziabad have tested positive for coronavirus,1
18566,1260213629854650112,https://www.thequint.com/news/webqoof/old-video-used-to-claim-dmk-leader-assaulted-lady-doctor-on-duty-fact-check,Tamil Nadu DMK party leader Selvakumar kicked a lady doctor on duty,1
18567,1262761981754240000,https://www.thequint.com/news/webqoof/old-video-used-to-claim-dmk-leader-assaulted-lady-doctor-on-duty-fact-check,Tamil Nadu DMK party leader Selvakumar kicked a lady doctor on duty,1
18568,1267066104586710016,https://www.thequint.com/news/webqoof/old-video-used-to-claim-dmk-leader-assaulted-lady-doctor-on-duty-fact-check,Tamil Nadu DMK party leader Selvakumar kicked a lady doctor on duty,1
