#,tweet_id,evidence_url,claim_reviewed,indian
7169,1210911926902909952,https://www.altnews.in/no-anti-caa-protesters-did-not-chant-pakistan-zindabad-in-lucknow-rally/,'Pakistan zindabad' slogan raised by anti-CAA protesters in Lucknow rally,1
7182,1210959343274739968,https://www.altnews.in/no-anti-caa-protesters-did-not-chant-pakistan-zindabad-in-lucknow-rally/,'Pakistan zindabad' slogan raised by anti-CAA protesters in Lucknow rally,1
7198,1210942991474419968,https://www.altnews.in/no-anti-caa-protesters-did-not-chant-pakistan-zindabad-in-lucknow-rally/,'Pakistan zindabad' slogan raised by anti-CAA protesters in Lucknow rally,1
7224,1210888411264869888,https://www.altnews.in/no-anti-caa-protesters-did-not-chant-pakistan-zindabad-in-lucknow-rally/,'Pakistan zindabad' slogan raised by anti-CAA protesters in Lucknow rally,1
7267,1206419665641080064,https://www.altnews.in/no-amu-students-did-not-raise-the-slogan-hinduon-ki-kabr-khudegi/,"AMU students raise slogans, ""Hinduon ki kabr khudegi""",1
7446,1206496944958259968,https://www.altnews.in/no-amu-students-did-not-raise-the-slogan-hinduon-ki-kabr-khudegi/,"AMU students raise slogans, ""Hinduon ki kabr khudegi""",1
7513,1174189872841669888,https://www.altnews.in/unrelated-video-from-2017-shared-to-claim-delhi-police-halted-ambulance-for-bjp-mp-manoj-tiwari/,Delhi police halted ambulance for BJP MP Manoj Tiwari,1
7548,1184420025362289920,https://www.altnews.in/has-indias-global-hunger-index-ranking-fallen-from-55-in-2014-to-102-in-2019-a-fact-check/,India's ranking in Global Hunger Index (GHI) has fallen from 55 in 2014 to 102 in 2019,1
7567,1210091226709380096,https://www.altnews.in/video-from-2011-viral-with-false-claim-that-muslim-man-wore-sikh-turban-during-anti-caa-protest/%20%7C%20https:/twitter.com/Afraoo7/status/1210091226709381123,Muslim man dressed as Sikh during CAA protest,1
7576,1203401341051290112,https://www.altnews.in/false-claim-muslim-parties-want-to-declare-belgium-an-islamic-state-after-recent-elections/,Muslim parties in Belgium seeking to establish Islamic state,1
7578,1205782728106490112,https://www.altnews.in/false-claim-muslim-parties-want-to-declare-belgium-an-islamic-state-after-recent-elections/,Muslim parties in Belgium seeking to establish Islamic state,1
7579,1206253064799180032,https://www.altnews.in/false-claim-muslim-parties-want-to-declare-belgium-an-islamic-state-after-recent-elections/,Muslim parties in Belgium seeking to establish Islamic state,1
7580,1172724644626880000,https://www.altnews.in/jatayu-mythical-bird-from-ramayana-spotted-in-kerala-no-its-a-condor-from-argentina/,Mythical bird Jatayu spotted at Chadayamangalam in Kerala,1
7595,1192294839192310016,https://www.boomlive.in/were-pakistan-flags-spotted-in-jalandhar-a-factcheck/,"Pakistan Flag Hoisted In Vijay Colony Of Jalandhar, Punjab",1
7600,1196617088359529984,https://www.altnews.in/no-he-is-not-47-year-old-moinuddin-from-kerala-but-2019-student-from-jnu-named-pankaj-mishra/,Photo claimed to be of 47 year old JNU student Moinuddin,1
7659,1196691206769499904,https://www.altnews.in/is-sonia-gandhi-the-4th-richest-woman-in-the-world-as-claimed-by-viral-social-media-posts/,Sonia Gandhi fourth richest in the world,1
7661,1199281917884950016,https://www.altnews.in/tree-grows-through-car-overnight-no-it-is-an-art-installation/,Tree grows through car overnight,1
7663,1175790210002690048,https://www.altnews.in/news18-cnbc-awaz-misreport-india-us-joint-army-exercise-as-howdy-modi-preparations/,US army playing the Indian national anthem in preparation for PM Modi,1
8011,1183973024074099968,https://www.altnews.in/fact-check-did-india-fall-from-55-to-103-in-global-hunger-index-rankings-between-2014-18/,India was ranked 55 in 2014 Global Hunger Index,1
8039,1205087033464499968,https://www.altnews.in/image-of-narasimha-idol-in-iskcon-wb-viral-as-32000-year-old-idol-found-in-germany/,A 32000-year-old idol of Lord Narasimha found in German,1
8128,1192370708824890112,https://www.altnews.in/video-of-islamic-flags-hoisted-in-punjab-shared-as-pakistani-flags/,Video of Pakistani flags hoisted in Jalandhar's Vijay colony,1
8129,1191961669909570048,https://www.altnews.in/video-of-islamic-flags-hoisted-in-punjab-shared-as-pakistani-flags/,Video of Pakistani flags hoisted in Jalandhar's Vijay colony,1
8132,1192294839192310016,https://www.altnews.in/video-of-islamic-flags-hoisted-in-punjab-shared-as-pakistani-flags/,Video of Pakistani flags hoisted in Jalandhar's Vijay colony,1
8304,1200458867550779904,https://www.altnews.in/viral-message-claims-nirbhaya-helpline-number-launched-for-women-safety-what-is-the-truth/,Women's helpline number 9833312222,1
8327,1203505485422320128,https://www.altnews.in/old-video-of-public-execution-of-rape-convict-in-yemen-shared-as-dubai/,Video of a man shot to death for raping a five-year-old in Dubai after a court order within 15 minutes of the incident,1
8335,1205631156747529984,https://www.altnews.in/did-it-take-19-photographers-62-days-to-capture-this-bird-fact-check/,It took 19 photographers 62 days to capture video of bird which is called Suraga in Tamil Nadu,1
8369,1205519003323520000,https://www.altnews.in/rahul-gandhi-did-not-say-women-should-be-raped-as-claimed-by-union-minister-smriti-irani/,Rahul Gandhi said 'Rape in India' - women should be raped,1
8402,1205829627165329920,https://www.altnews.in/old-video-shared-as-girl-found-in-mangalore-with-a-group-of-tamil-beggars/,This beautiful girl was seen in Mangalore with a group of Tamil beggars,1
8782,1172361138803109888,https://www.altnews.in/old-video-from-himachal-pradesh-shared-as-felling-of-apple-trees-by-govt-in-kashmir/,Indian govt destroying apple gardens in Kashmir,1
8785,1173663094595360000,https://www.altnews.in/old-video-from-himachal-pradesh-shared-as-felling-of-apple-trees-by-govt-in-kashmir/,Indian govt destroying apple gardens in Kashmir,1
8798,1173098513237860096,https://www.altnews.in/media-outlets-fall-for-ips-officers-false-claim-about-pak-baby-smuggled-in-a-bag-to-dubai/,5-month-old baby kidnapped and carried to Dubai from Karachi inside a travel bag,1
8810,1175374127030360064,https://www.altnews.in/media-outlets-fall-for-ips-officers-false-claim-about-pak-baby-smuggled-in-a-bag-to-dubai/,5-month-old baby kidnapped and carried to Dubai from Karachi inside a travel bag,1
8884,1175790210002690048,https://www.boomlive.in/news-18-cnbc-awaaz-misreport-indo-us-army-exercise-as-howdy-modi-preparations/,US Army Playing Indian National Anthem In Preparation For PM Narendra Modi Arrival At Howdy Event.,1
8916,1175825869530530048,https://www.boomlive.in/did-pm-modis-pro-growth-reforms-lift-300-mn-people-out-of-poverty-as-claimed-by-president-trump/,India helped 300 million people come out of poverty in a decade due to Modis pro-growth policies,1
8922,1176407422782439936,https://www.boomlive.in/french-president-macron-dancing-with-his-wife-23-years-ago-a-factcheck/,"23 Years Old Television Clip Of Boy Who Is Current President Of France, Emmanuel Macron And The Lady Dancer Is His Then teacher And Current Wife.",1
8946,1177084766140549888,https://www.altnews.in/video-of-scuffle-at-mangaluru-mall-shared-with-false-communal-narrative/,Scuffle at Mangaluru mall due to eve-teasing of girls by 'peacefuls',1
9025,1179449694730119936,https://www.altnews.in/media-misreports-that-pak-pm-was-called-welder-from-bronx-by-american-anchor/,"American TV anchor called Pakistani PM Imran Khan ""welder from Bronx""",1
9038,1179590591325380096,https://www.boomlive.in/video-of-gujarat-businessman-viral-as-morarji-desai-playing-dandiya/,Morarji Desai Playing Garba and Dandiya,1
9080,1181522001455960064,https://www.altnews.in/false-claim-tanmay-bakshi-13-year-old-indian-boy-appointed-by-google-with-rs-66-lakh-salary/,Indian boy Tanmay Bakshi hired by Google for Rs.66 lakh per annum,1
9121,1181997558391960064,https://www.altnews.in/old-video-of-ex-defence-ministers-wife-performing-puja-on-ins-vikrant-shared-as-baptism/,Video of former Defence minster wife Elizabeth Antony baptizing aircraft carrier INS Vikrant,1
9124,1181929911193240064,https://www.altnews.in/old-video-of-ex-defence-ministers-wife-performing-puja-on-ins-vikrant-shared-as-baptism/,Video of former Defence minster wife Elizabeth Antony baptizing aircraft carrier INS Vikrant,1
9378,1161182996780800000,https://www.altnews.in/2018-kulgam-blast-video-shared-in-pak-social-media-as-kashmiris-massacred-in-recent-unrest/,Indian forces are brutally killing people in Kashmir during the lockdown,1
9402,1108018726106850048,https://www.boomlive.in/did-modi-promise-to-deposit-rs-15-lakh-in-every-account-a-factcheck/,Modi Promised To Deposit Rs 15 Lakh In Every Account,1
9411,1110593508556109952,https://www.boomlive.in/did-modi-promise-to-deposit-rs-15-lakh-in-every-account-a-factcheck/,Modi Promised To Deposit Rs 15 Lakh In Every Account,1
9430,1165547825196930048,https://www.boomlive.in/clash-between-tmc-bjp-workers-passed-off-as-kashmir/,RSS Hooligans Are Evacuating Muslim Settlements In Kashmir,1
9538,1136611566793580032,https://www.altnews.in/murder-of-child-in-aligarh-fact-checking-social-media-claims/,Two and a half-year old victim of Aligarh murder case was raped and mutilated,1
9541,1136570459007340032,https://www.altnews.in/murder-of-child-in-aligarh-fact-checking-social-media-claims/,Two and a half-year old victim of Aligarh murder case was raped and mutilated,1
9563,1136522743581570048,https://www.altnews.in/murder-of-child-in-aligarh-fact-checking-social-media-claims/,Two and a half-year old victim of Aligarh murder case was raped and mutilated,1
9569,1136683944122889984,https://www.altnews.in/murder-of-child-in-aligarh-fact-checking-social-media-claims/,Two and a half-year old victim of Aligarh murder case was raped and mutilated,1
9595,1136592090178000000,https://www.altnews.in/murder-of-child-in-aligarh-fact-checking-social-media-claims/,Two and a half-year old victim of Aligarh murder case was raped and mutilated,1
9630,1160063480923209984,https://www.boomlive.in/simulated-video-of-underwater-volcanic-eruption-shared-as-real-incident/,Video shows volcanic eruption at Mount Sinabung in Indonesia,1
9631,1141366782650829952,https://www.boomlive.in/simulated-video-of-underwater-volcanic-eruption-shared-as-real-incident/,Video shows volcanic eruption at Mount Sinabung in Indonesia,1
9667,1119203814677069952,https://www.altnews.in/amit-malviya-targets-yogendra-yadav-via-edited-video-clip-after-tv-debate-face-off/,Yogendra Yadav appealed to Muslim voters on the basis of religious identity,1
9945,1153222825789910016,https://www.altnews.in/no-this-video-is-not-of-a-make-in-india-train-manufactured-for-sydney-metro/,Video claims to show double-decker metro train manufactured under 'Make in India' for Sydney metro,1
9976,1164176032230010112,https://www.boomlive.in/9-year-old-video-of-canada-refusing-visas-to-indian-army-officers-shared-as-recent/,Recent News Report That Canada refuses visa for Indian Army Generals and Brigadiers who served as intelligence officers for their part in Kashmir.,1
9991,1105660202337100032,https://www.altnews.in/did-pak-army-admit-200-killed-in-balakot-indian-media-runs-video-without-verification/,Pakistani army admitted to the deaths of 200 terrorists,1
10011,1105722283924969984,https://www.altnews.in/did-pak-army-admit-200-killed-in-balakot-indian-media-runs-video-without-verification/,Pakistani army admitted to the deaths of 200 terrorists,1
10019,1146352635244499968,https://www.altnews.in/zee-news-falsely-claims-mahua-moitra-plagiarised-her-maiden-parliament-speech/,TMC MP Mahua Moitra plagiarised her maiden Parliamentary speech,1
10114,1147745158219229952,https://www.altnews.in/no-fm-nirmala-sitharaman-did-not-claim-that-modi-govt-distributed-35000-crore-led-bulbs/,Nirmala Sitharaman claimed that government distributed 35000 crore bulbs,1
10148,1143899344187209984,https://www.altnews.in/false-claim-rain-cloud-generating-machine-developed-by-nasa/,NASA has developed a cloud generating machine,1
10155,1154449256809289984,https://www.altnews.in/video-from-andhra-pradesh-college-shared-as-incident-in-kendriya-vidyalaya-school/,"Video showing young man beaten up, from Kendriya Vidyalaya school",1
10159,1154942255179760128,https://www.boomlive.in/pimpri-police-dismiss-communal-angle-in-hitesh-mulchandani-murder/,Muslim gang killed Hitesh Mulchandani,1
10205,1155839968972960000,https://www.boomlive.in/crocodile-rescued-from-ratnagiri-drain-shared-as-mumbai/,"Crocodile found in Dadar, Mumbai",1
10206,1155798154769509888,https://www.boomlive.in/crocodile-rescued-from-ratnagiri-drain-shared-as-mumbai/,"Crocodile found in Dadar, Mumbai",1
10207,1155796071156600064,https://www.boomlive.in/crocodile-rescued-from-ratnagiri-drain-shared-as-mumbai/,"Crocodile found in Dadar, Mumbai",1
10209,1155807594843229952,https://www.boomlive.in/crocodile-rescued-from-ratnagiri-drain-shared-as-mumbai/,"Crocodile found in Dadar, Mumbai",1
10211,1155722189401779968,https://www.boomlive.in/crocodile-rescued-from-ratnagiri-drain-shared-as-mumbai/,"Crocodile found in Dadar, Mumbai",1
10214,1155715223908600064,https://www.boomlive.in/crocodile-rescued-from-ratnagiri-drain-shared-as-mumbai/,"Crocodile found in Dadar, Mumbai",1
10215,1155524704771310080,https://www.boomlive.in/crocodile-rescued-from-ratnagiri-drain-shared-as-mumbai/,"Crocodile found in Dadar, Mumbai",1
10244,1159410653494429952,https://www.altnews.in/did-1st-muslim-minister-of-british-cabinet-lambast-nehru-over-education-policy/,'1st Muslim minister of British cabinet' lambasts Nehru,1
10245,1159123974334439936,https://www.boomlive.in/did-kashmiri-women-protest-abrogation-of-article-370-a-factcheck/,Hundreds Of Thousands Kashmiris Took Street Yesterday In Kashmir,1
10250,1159681960299699968,https://www.altnews.in/article-370-pak-minister-shares-burhan-wani-funeral-video-as-kashmiris-protesting-against-indian-govt/,Video of Kashmiris protesting against the Indian government's move to repeal Article 35 A,1
10267,1161182996780800000,https://www.boomlive.in/old-video-of-kashmiris-wounded-in-a-shell-explosion-resurfaces-with-false-claim/,Kashmiris tortured and killed by Indian army after lockdown,1
10302,1162749646696880128,https://www.altnews.in/italian-air-force-celebrating-italys-republic-day-viral-as-indian-independence-day-celebration-at-trafalgar-square/,"Indian Independence Day celebrated in Trafalgar square, London",1
10335,1166502600721649920,https://www.boomlive.in/satire-website-thin-air-todays-story-on-saudi-man-accidentally-buying-two-aircraft-takes-off/,Saudi Man Accidentally Buys Two Airbus Aircraft For Sons Birthday,1
10370,1166673793852549888,https://www.boomlive.in/half-baked-plastic-rice-rumours-resurface-online/,Plastic Rice Served In Train,1
10371,1166391765353370112,https://www.boomlive.in/half-baked-plastic-rice-rumours-resurface-online/,Plastic Rice Served In Train,1
10372,1166920493707849984,https://www.boomlive.in/video-of-distraught-woman-narrating-her-ordeal-to-rahul-gandhi-goes-viral-with-false-claim/,Kashmiri people on board a flight tell Rahul Gandhi to go back as Modi was doing good for them,1
10373,1166369125540649984,https://www.boomlive.in/video-of-distraught-woman-narrating-her-ordeal-to-rahul-gandhi-goes-viral-with-false-claim/,Kashmiri people on board a flight tell Rahul Gandhi to go back as Modi was doing good for them,1
10374,1166654896759660032,https://www.boomlive.in/video-of-distraught-woman-narrating-her-ordeal-to-rahul-gandhi-goes-viral-with-false-claim/,Kashmiri people on board a flight tell Rahul Gandhi to go back as Modi was doing good for them,1
10375,1166580523415810048,https://www.boomlive.in/fake-message-claims-children-kidnapped-in-ghaziabad-police-warn-against-rumours/,Please Do Take Care Of Your Kids Today Three Kids From Gaurcity Indirapuram Round Circles Have Been Kidnapped While Going To School,1
10385,1124895452304800000,https://www.altnews.in/old-video-of-inter-family-dispute-shared-as-bjp-mla-beating-up-a-dalit-youth/,Video of BJP MLA Anil Upadhya commiting atrocity on a Dalit,1
10561,1121606094386809984,https://www.altnews.in/did-a-tmc-leader-pull-out-a-gun-on-live-tv-no-it-was-a-mike/,TMC leader pulled out a gun during a live debate,1
10584,1133078284437200000,https://www.altnews.in/amartya-sen-and-nalanda-university-debunking-a-web-of-untruths/,Corruption and nepotism allegations against Dr Amartya Sen's tenure at Nalanda University,1
10593,1132932300549699968,https://www.altnews.in/bjp-mp-terms-death-of-19-year-old-in-belagavi-as-murder-by-cow-smugglers-post-mortem-confirms-suicide/,"19 year old Shivu Uppar killed by cow smugglers in Belgaum, Karnataka",1
10737,1105872782355689984,https://www.boomlive.in/video-claiming-to-capture-ethiopian-plane-crash-is-from-afghanistan/,Video of the recent Ethiopian Airlines crash,1
10740,1105660202337100032,https://www.altnews.in/ravi-shankar-prasad-cites-misleading-video-shared-by-media-as-proof-of-balakot-casualties/,200 people killed in Balakot,1
10742,1105722283924969984,https://www.altnews.in/ravi-shankar-prasad-cites-misleading-video-shared-by-media-as-proof-of-balakot-casualties/,200 people killed in Balakot,1
10752,1108275643714880000,https://www.altnews.in/mp-congress-shares-old-video-of-bjp-worker-harassing-a-woman-with-false-narrative/,Video BJP MLA beaten up for harassing a woman,1
10791,1114867664025939968,https://www.altnews.in/mp-congress-shares-clipped-video-of-rajnath-singh-rally-crowd-did-not-say-chowkidar-chor-hai/,Crowd responds with 'Chowkidar Chor Hai' when Rajnath Singh asked to raise a slogan,1
10830,1114163299644349952,https://www.altnews.in/terror-attack-at-ambaji-temple-in-gujarat-no-it-is-a-mock-drill-video/,Two terrorist attack Ambaji temple,1
10888,1116351807536530048,https://www.boomlive.in/can-you-ask-for-a-challenge-vote-if-your-name-is-not-on-a-voter-list/,"Message Claims If A Voters Name Is Not On The Voters List, A Person Can Cast Their Vote Using Challenge Vote",1
10889,1116285781943949952,https://www.altnews.in/video-from-2017-viral-as-burqa-clad-women-casting-fake-votes-in-muzaffarnagar-ls-polls/,BJP worker stopped burq-clad women from casting fake votes,1
10947,1119203814677069952,https://www.boomlive.in/amit-malviya-shares-edited-video-to-accuse-yogendra-yadav-of-playing-communal-politics/,Yogendra Yadav claims he is a Muslim and does caste based politics,1
10999,1121099713929859968,https://www.altnews.in/did-a-bjp-leader-have-a-clothing-malfunction-while-campaigning-old-video-false-claim/,Ajmer BJP candidate Rakesh Pareekh's trouser came off in a rally,1
11045,1084976453337400064,https://www.altnews.in/video-of-rahul-gandhi-paying-tribute-at-dargah-viral-as-praying-for-muslim-kingdom-in-india/,Muslims are taking Oath in front of Rahul Gandhi and Ghulam Nabi Azad against Hindus,1
11225,1354364346437159936,https://www.indiatoday.in/fact-check/story/fact-check-this-video-of-pro-khalistan-rally-is-not-linked-to-farmers-protest-1748158-2020-12-09,"Video shows protesters carrying swords and raising pro-Khalistan slogans during the ongoing farmers’ agitation.
",1
11226,1354342539374050048,https://www.indiatoday.in/fact-check/story/fact-check-this-video-of-pro-khalistan-rally-is-not-linked-to-farmers-protest-1748158-2020-12-09,"Video shows protesters carrying swords and raising pro-Khalistan slogans during the ongoing farmers’ agitation.
",1
11242,1355060326446759936,https://www.indiatoday.in/fact-check/story/fact-check-officials-posing-for-covid-19-vaccine-is-not-what-it-looks-like-1761512-2021-01-21,Video shows Karnataka government officials faking the Covid-19 vaccination process. ,1
11249,1359362486550540032,https://www.indiatoday.in/fact-check/story/fact-check-truth-of-the-flag-hoisted-at-red-fort-by-protesting-farmers-1762991-2021-01-26,Khalistani flag hoisted on Red Fort on Republic Day by protesting farmers. This is a Black Day for India.,1
11253,1354023383617260032,https://www.indiatoday.in/fact-check/story/fact-check-truth-of-the-flag-hoisted-at-red-fort-by-protesting-farmers-1762991-2021-01-26,Khalistani flag hoisted on Red Fort on Republic Day by protesting farmers. This is a Black Day for India.,1
11293,1382892891945659904,https://www.indiatoday.in/fact-check/story/fact-check-japanese-nobel-laureate-never-said-china-manufactured-coronavirus-1685206-2020-06-03,Japanese Nobel laureate Dr. Tasuku Honjo has said China manufactured coronavirus and he once worked at the Wuhan lab which later produced it.,1
11333,1084518643533139968,https://www.altnews.in/did-rahul-gandhi-claim-gandhijis-non-violence-was-inspired-by-islam-clipped-video-viral/,Rahul Gandhi said Mahatma Gandhi's non-violence was inspired by Islam,1
11339,1084473262015459968,https://www.altnews.in/did-rahul-gandhi-claim-gandhijis-non-violence-was-inspired-by-islam-clipped-video-viral/,Rahul Gandhi said Mahatma Gandhi's non-violence was inspired by Islam,1
11343,1084806115555040000,https://www.altnews.in/did-rahul-gandhi-claim-gandhijis-non-violence-was-inspired-by-islam-clipped-video-viral/,Rahul Gandhi said Mahatma Gandhi's non-violence was inspired by Islam,1
11532,1348096988181459968,https://thelogicalindian.com/fact-check/balakot-strike-26076,Ex Pakistani diplomat in a debate accepted that 300 people were killed in Balakot strike.,1
11567,1351211556407820032,https://www.thequint.com/news/webqoof/farmer-sprinkling-water-on-wheat-sacks-fake-news-fact-check,Farmer in Punjab sprinkling water on wheat sacks to rotten the grains and sell them to breweries,1
11570,1351910887704169984,https://thelogicalindian.com/fact-check/coronavirus-vaccine-26304,The DHO of Tumkur and Principal of government nursing college are pretending to take coronavirus vaccine and have not taken the vaccine in real.,1
11588,1354342539374050048,https://www.thequint.com/news/webqoof/farmers-with-swords-raising-pro-khalistan-slogans-video-is-old,Farmers With Swords Raised 'Khalistan Zindabad' Slogans,1
11675,1369604846366560000,https://www.thequint.com/news/webqoof/aiudf-chief-calling-for-islamic-nation-fact-check,AIUDF chief Badruddin Ajmal said that if voted to power India will become Islamic country,1
11686,1371178316514929920,https://thelogicalindian.com/fact-check/bjp-mla-in-punjab-27381,All three MLAs of BJP in Punjab have quit the party and joined Congress.,1
11762,1384367389823930112,https://www.thequint.com/news/webqoof/video-of-delhi-man-stabbing-wife-passed-off-as-journalist-murder,Journalist Pragya Mishra murdered for speaking about Kumbh mela amid coronavirus pandemic,1
11769,1385780735978530048,https://www.indiatoday.in/fact-check/story/fact-check-nebuliser-not-substitute-oxygen-cylinder-1794571-2021-04-24,Nebuliser can be used as a substitute for oxygen cylinder.,1
11770,1385839304442739968,https://www.indiatoday.in/fact-check/story/fact-check-nebuliser-not-substitute-oxygen-cylinder-1794571-2021-04-24,Nebuliser can be used as a substitute for oxygen cylinder.,1
11863,1358898648483000064,https://www.snopes.com/fact-check/congress-expelled-lincoln-election/,"In 1861, three U.S. House members and 11 Senators were expelled for supporting the Confederacy and not acknowledging Abraham Lincoln's election as president.",0
11869,1345540378242340096,https://www.snopes.com/fact-check/congress-expelled-lincoln-election/,"In 1861, three U.S. House members and 11 Senators were expelled for supporting the Confederacy and not acknowledging Abraham Lincoln's election as president.",0
11976,1346952160601390080,https://www.snopes.com/fact-check/pence-trump-twitter-jan-6-riots/,"U.S. Vice President Mike Pence unfollowed President Donald Trump following Jan. 6, 2021, riots in Washington, D.C.",0
11977,1346923614080140032,https://www.snopes.com/fact-check/pence-trump-twitter-jan-6-riots/,"U.S. Vice President Mike Pence unfollowed President Donald Trump following Jan. 6, 2021, riots in Washington, D.C.",0
12006,1346836957633129984,https://www.snopes.com/fact-check/trump-steal-kids-cancer-charity/,Members of the Trump family were banned from running charities in New York because they reportedly stole from a children's cancer charity.,0
12008,1347305247966980096,https://www.snopes.com/fact-check/trump-steal-kids-cancer-charity/,Members of the Trump family were banned from running charities in New York because they reportedly stole from a children's cancer charity.,0
12180,1347282394554970112,https://www.snopes.com/fact-check/noose-hung-outside-capitol/,"A photograph shows a noose hanging across from the U.S. Capitol before a pro-Trump riot on Jan. 6, 2021.",0
12287,1351003906734759936,https://www.snopes.com/fact-check/pardon-during-impeachment/,A president under impeachment is prohibited from issuing pardons.,0
12289,1347293556566860032,https://www.snopes.com/fact-check/pardon-during-impeachment/,A president under impeachment is prohibited from issuing pardons.,0
12295,1348305456712859904,https://www.snopes.com/fact-check/elizabeth-knoxville-onion-towel/,A video shows a crying woman holding an onion while telling a reporter that she had been Maced during a riot.,0
12340,1348059033845060096,https://www.snopes.com/fact-check/trump-flag-american-flag-capitol/,"A Trump flag was raised in place of an American flag at the U.S. Capitol on Jan 6, 2020.",0
12341,1347456818461649920,https://www.snopes.com/fact-check/trump-flag-american-flag-capitol/,"A Trump flag was raised in place of an American flag at the U.S. Capitol on Jan 6, 2020.",0
12417,1347985413453989888,https://www.snopes.com/fact-check/twitter-censor-1984-orwell/,Twitter banned the use of the hashtag #1984 in January 2021.,0
12428,1347987925418579968,https://www.snopes.com/fact-check/warnock-arrested-capitol-praying/,Rev. Raphael Warnock was arrested while praying during a demonstration at the U.S. Capitol in 2017.,0
12535,1349835381592649984,https://www.snopes.com/fact-check/boebert-tweet-pelosi-location/,"Republican congresswoman Lauren Boebert tweeted about House Speaker Nancy Pelosi's whereabouts during the Jan. 6, 2021 Capitol riot.",0
