#,tweet_id,evidence_url,claim_reviewed,indian
2756,1278029668159909888,https://www.altnews.in/murder-of-rss-worker-by-alleged-bjp-member-in-tamil-nadu-shared-with-false-claims/,"Swayam Sevak's father murdered by extremists, Muslims in Kumbakonam",1
2801,1351205815882010112,https://www.boomlive.in/world/bacterial-pneumonia-is-not-caused-by-wearing-face-masks-10331,The 1918 influenza pandemic originated from bacterial pneumonia caused by face masks and Dr Anthony Fauci knew about it.,1
2847,1255546073986160128,https://www.boomlive.in/world/exclusive-video-of-kim-jong-uns-funeral-not-quite-7874,This video is from Kim Jong-uns funeral.,1
2860,1250065566397880064,https://www.altnews.in/tree-grows-through-car-overnight-no-it-is-an-art-installation/,Tree grows through car overnight,1
2943,1253394449352160000,https://www.boomlive.in/fake-news/video-of-islamic-funeral-home-in-new-york-viral-with-communal-claim-7803,Video Show The Dawah Group Is littered With Dead Bodies Inside Their Own Apartments,1
2944,1254273703086599936,https://www.boomlive.in/fake-news/video-of-islamic-funeral-home-in-new-york-viral-with-communal-claim-7803,Video Show The Dawah Group Is littered With Dead Bodies Inside Their Own Apartments,1
2945,1254391365976430080,https://www.boomlive.in/fake-news/video-of-islamic-funeral-home-in-new-york-viral-with-communal-claim-7803,Video Show The Dawah Group Is littered With Dead Bodies Inside Their Own Apartments,1
2946,1253687707236069888,https://www.boomlive.in/fake-news/video-of-islamic-funeral-home-in-new-york-viral-with-communal-claim-7803,Video Show The Dawah Group Is littered With Dead Bodies Inside Their Own Apartments,1
2959,1243968386578650112,https://www.boomlive.in/fake-news/false-passengers-infected-with-coronavirus-at-senegal-airport-7269,Video Shows Passengers With Coronavirus Getting Out Of Ethiopian Airlines Flight From Italy To Addis Ababa Airport.,1
2961,1218564800499739904,https://www.boomlive.in/fast-check/kanhaiya-kumar-converts-to-islam-no-doctored-video-revived-6590,Video claiming Kanhaiya Kumar has converted to Islam.,1
2983,1222794296190889984,https://www.altnews.in/bjp-mla-karni-singh-toppled-ambedkars-statue-old-video-false-claim/,Video of Ambedkar statue toppled by BJP MLA Karni Singh,1
3005,1261954937405139968,https://www.altnews.in/sp-leader-abu-azmis-supporters-did-not-chant-pakistan-zindabad-video-viral-with-false-claim/,Video of SP leader Abu Azmi's supporter raising Pakistan Zindabad slogans at Wadala station,1
3010,1264432814751200000,https://www.altnews.in/sp-leader-abu-azmis-supporters-did-not-chant-pakistan-zindabad-video-viral-with-false-claim/,Video of SP leader Abu Azmi's supporter raising Pakistan Zindabad slogans at Wadala station,1
3016,1262761981754240000,https://www.altnews.in/old-video-of-dmk-leader-assaulting-woman-resurfaces-as-attacking-doctor/,Video of a DMK leader Selvakumar assaulting a lady doctor,1
3017,1262815280327249920,https://www.altnews.in/old-video-of-dmk-leader-assaulting-woman-resurfaces-as-attacking-doctor/,Video of a DMK leader Selvakumar assaulting a lady doctor,1
3018,1267066104586710016,https://www.altnews.in/old-video-of-dmk-leader-assaulting-woman-resurfaces-as-attacking-doctor/,Video of a DMK leader Selvakumar assaulting a lady doctor,1
3028,1238996265297420032,https://www.altnews.in/video-of-hindu-monk-beaten-for-misbehaving-with-child-shared-with-false-communal-narrative/,Video of a Hindu priest beaten for getting inside their train coach with majority Christians,1
3030,1239116815449710080,https://www.altnews.in/video-of-hindu-monk-beaten-for-misbehaving-with-child-shared-with-false-communal-narrative/,Video of a Hindu priest beaten for getting inside their train coach with majority Christians,1
3079,1245648504854210048,https://www.altnews.in/video-verification-locals-in-indores-tatpatti-bakhal-area-pelt-stones-at-health-workers/,Video of locals in Indore chasing away health workers and pelting stones at them,1
3088,1237908084296679936,https://www.altnews.in/no-china-didnt-grant-permission-to-read-quran-in-the-light-of-coronavirus-epidemic/,Video of people in China given permission to read the Quran in the light of coronavirus epidemic,1
3090,1242143695157289984,https://www.altnews.in/vidoe-of-a-corona-virus-patient-named-mubashir-viral-as-that-of-deceased-26-year-old-doctor-riaz/,Video of the final message by Pakistani doctor Usama Riaz who lost his life after contracting the virus while treating coronavirus patients,1
3141,1290192269128029952,https://www.boomlive.in/fast-check/no-this-video-does-not-show-frances-farewell-to-rafale-aircraft-9147,Video show farewell from France with jets forming Indian tricolour for Rafale aircraft destined for India,1
3148,1280688689580879872,https://www.boomlive.in/fast-check/no-this-video-does-not-show-people-standing-on-ram-setu-bridge-8804,Video showing people standing on Ram Setu in Tamil Nadu in the middle of the sea.,1
3149,1229405274546540032,https://www.boomlive.in/fake-news/coronavirus-indonesian-market-video-viral-as-wuhan-china-6697,"Video showing unhygienic animal market in Wuhan, China",1
3156,1221311863167699968,https://www.boomlive.in/fake-news/was-a-bjp-candidate-caught-on-video-offering-a-bribe-to-delhi-voters-6655,Video shows BJP candidate offering a bribe to voters in Delhi,1
3162,1238996265297420032,https://www.boomlive.in/fake-news/video-of-alleged-molester-thrashed-in-train-shared-with-communal-spin-7270,Video shows Christian passengers beating a Hindu monk for sitting in their compartment,1
3168,1241637256353349888,https://www.boomlive.in/fake-news/no-trump-did-not-announce-the-launch-of-a-coronavirus-vaccine-by-roche-7248,Video shows Donald Trump announcing the launch of COVID-19 coronavirus vaccines by Roche Medical Company.,1
3181,1288134219881840128,https://www.boomlive.in/fake-news/2018-video-of-dhol-tasha-performance-peddled-as-ram-mandir-celebration-9091,Video shows Indians celebrating in Spain on the occasion of building Ram temple in Ayodhya.,1
3184,1217011240620310016,https://www.boomlive.in/doctored-video-of-kanhaiya-kumar-speaking-on-islam-revived/,Video shows Kanhaiya Kumar is actually a Muslim,1
3210,1292458321572770048,https://www.boomlive.in/fake-news/video-of-men-uprooting-saplings-in-pakistan-viral-with-islamophobic-claim-9238,Video shows Muslims uprooting saplings in Pakistan as planting trees is against Islam,1
3212,1292476682310299904,https://www.boomlive.in/fake-news/video-of-men-uprooting-saplings-in-pakistan-viral-with-islamophobic-claim-9238,Video shows Muslims uprooting saplings in Pakistan as planting trees is against Islam,1
3223,1293138409771239936,https://www.boomlive.in/fake-news/this-video-does-not-show-vladimir-putins-daughter-receiving-covid-19-shots-9270,Video shows Putins daughter being injected with COVID-19 vaccine,1
3224,1293122356362109952,https://www.boomlive.in/fake-news/this-video-does-not-show-vladimir-putins-daughter-receiving-covid-19-shots-9270,Video shows Putins daughter being injected with COVID-19 vaccine,1
3231,1245750133381139968,https://www.boomlive.in/fake-news/dated-video-of-trupti-desai-being-detained-revived-with-lockdown-twist-7501,Video shows Trupti Desai was arrested by police while trying to buy liquor during the lockdown,1
3240,1283366425718080000,https://www.boomlive.in/fake-news/digitally-edited-clip-viral-as-three-eyed-baby-born-in-germany-8874,Video shows a child born in Germany with three eyes,1
3254,1216016523493629952,https://www.boomlive.in/fake-news/video-of-cops-thrashed-resurfaces-with-communal-spin-6546,Video shows cops being thrashed by Muslims,1
3255,1263930861382249984,https://www.boomlive.in/fake-news/video-of-pm-modis-visit-to-cyclone-hit-wb-edited-with-chowkidar-chor-hai-8220,Video shows crowd chanting Chowkidar chor hai slogans as PM Modi leaves in West Bengals Basirhat after Cyclone Amphan,1
3256,1265836837580400128,https://www.boomlive.in/fake-news/2016-video-of-birds-swarming-a-texas-supermarket-shared-as-saudi-arabia-8286,Video shows crows not allowing customers to come out of a super market in Saudi.,1
3269,1223158193578220032,https://www.boomlive.in/fake-news/amit-malviya-revives-old-video-of-aap-rally-with-misleading-caption-6729,Video shows man being lynched at a Kejriwal rally.,1
3270,1223163431819180032,https://www.boomlive.in/fake-news/amit-malviya-revives-old-video-of-aap-rally-with-misleading-caption-6729,Video shows man being lynched at a Kejriwal rally.,1
3277,1268967858081530112,https://www.boomlive.in/fake-news/video-of-policeman-set-on-fire-in-mexico-passed-off-as-us-protests-8393,Video shows policeman being set on fire during protests following George Floyds death.,1
3279,1355539927857910016,https://www.boomlive.in/fake-news/did-avoiding-the-future-plague-psa-predict-covid-19-pandemic-10237,Video shows public service announcement from 1956 predicting the 2020 COVID-19 pandemic.,1
3282,1293423236634409984,https://www.boomlive.in/fake-news/flight-simulation-video-peddled-as-pilots-battling-crosswinds-9269,Video shows some hair raising landings which still managed to survive a crash,1
3284,1292125107335229952,https://www.boomlive.in/fake-news/retd-vice-admirals-video-viral-as-air-india-pilot-deepak-sathe-singing-9227,"Video shows song rendered by Deepak Sathe, Air India Express Pilot, who passed away in Kerala plane crash",1
3289,1254056388117929984,https://www.boomlive.in/fake-news/us-students-sing-national-anthem-to-thank-india-for-hydroxychloroquine-a-factcheck-7804,Video shows students in the US sang the Indian national anthem to thank India for supplying hydroxychloroquine,1
3299,1267494363015379968,https://www.boomlive.in/fake-news/fbi-agent-accidentally-arrested-during-2020-us-protests-a-factcheck-8328,Video shows undercover FBI agent being accidentally arrested during the 2020 US protests.,1
3302,1267416749001129984,https://www.boomlive.in/fake-news/fbi-agent-accidentally-arrested-during-2020-us-protests-a-factcheck-8328,Video shows undercover FBI agent being accidentally arrested during the 2020 US protests.,1
3308,1267467982252509952,https://www.boomlive.in/fake-news/fbi-agent-accidentally-arrested-during-2020-us-protests-a-factcheck-8328,Video shows undercover FBI agent being accidentally arrested during the 2020 US protests.,1
5154,1473294597157649920,https://www.altnews.in/bjp-leader-gives-false-communal-spin-to-domestic-violence-case-in-pak-media-follows-suit/,Hindu woman abducted by Muslims in Pakistan,1
5225,1391434717627510016,https://www.altnews.in/did-upa-govt-build-only-one-aiims-institute-during-their-tenure-false-claim-viral/,UPA govt built only one AIIMS institute during their tenure,1
5256,1448899404941779968,https://www.altnews.in/fact-check-did-india-fall-from-55-to-103-in-global-hunger-index-rankings-between-2014-18/,India was ranked 55 in 2014 Global Hunger Index,1
5316,1448989105384160000,https://www.altnews.in/has-indias-global-hunger-index-ranking-fallen-from-55-in-2014-to-102-in-2019-a-fact-check/,India's ranking in Global Hunger Index (GHI) has fallen from 55 in 2014 to 102 in 2019,1
5554,1404787270838739968,https://www.altnews.in/media-falsely-reports-ramayana-mahabharata-to-be-taught-in-saudi-arabian-schools/,Ramayana and Mahabharata will be taught in Saudi Arabia,1
5559,1417277892543749888,https://www.altnews.in/media-falsely-reports-ramayana-mahabharata-to-be-taught-in-saudi-arabian-schools/,Ramayana and Mahabharata will be taught in Saudi Arabia,1
5627,1447049001920969984,https://www.altnews.in/no-this-is-not-punjab-cm-charanjit-channi-getting-baptised/,Punjab CM Charanjit Singh Channi gets baptised,1
5628,1447071688592529920,https://www.altnews.in/no-this-is-not-punjab-cm-charanjit-channi-getting-baptised/,Punjab CM Charanjit Singh Channi gets baptised,1
5631,1410201132249449984,https://www.altnews.in/no-white-house-has-not-declared-manmohan-singh-as-the-most-honest-political-leader/,White House declares Manmohan Singh as most honest political leader,1
5684,1403611900001220096,https://www.altnews.in/opindia-twists-womans-allegation-of-eve-teasing-at-tikri-border-as-rape-woman-issues-legal-notice/,Woman raped/ molested at Tikri border,1
5707,1390889552492080128,https://www.altnews.in/punjab-drug-control-officer-says-remdesivir-vials-found-in-bhakra-canal-are-fake/,Genuine Remdesivir vials thrown in Bhakra canal in Punjab,1
5779,1388572330566109952,https://www.altnews.in/video-of-reliance-stickers-installed-on-oxygen-tankers-viral-with-false-claim/,Reliance taking credit for oxygen supplied by Saudi Arabia,1
5782,1389151321475980032,https://www.altnews.in/video-of-reliance-stickers-installed-on-oxygen-tankers-viral-with-false-claim/,Reliance taking credit for oxygen supplied by Saudi Arabia,1
5785,1390665684716120064,https://www.altnews.in/video-of-reliance-stickers-installed-on-oxygen-tankers-viral-with-false-claim/,Reliance taking credit for oxygen supplied by Saudi Arabia,1
5803,1390728499598479872,https://www.altnews.in/video-of-reliance-stickers-installed-on-oxygen-tankers-viral-with-false-claim/,Reliance taking credit for oxygen supplied by Saudi Arabia,1
5825,1432980265064800000,https://www.altnews.in/were-modi-modi-slogans-raised-in-pakistan-parliament-india-tv-tv9-bharatvarsh-misreport/,'Modi Modi' slogans raised in Pakistani parliament,1
5826,1433471937053789952,https://www.altnews.in/were-modi-modi-slogans-raised-in-pakistan-parliament-india-tv-tv9-bharatvarsh-misreport/,'Modi Modi' slogans raised in Pakistani parliament,1
5831,1399976020095079936,https://www.altnews.in/zee-hindustan-links-video-from-ecuador-to-nurse-booked-in-up-for-throwing-vaccine-filled-syringes/,Video of ANM Neha Khan caught in UP pretending to vaccinate patient,1
5861,1434506958317380096,https://www.boomlive.in/fact-check/muzaffarnagar-maha-panchayat-rakesh-tikait-allah-hu-akbar-har-har-mahadev-farmers-protest-viral-video-fact-check-14581,"Tikait arrived in Muzaffarnagar Mahapanchayat, Slogans of Allah Hu Akbar! Is this a farmers movement? Is this anti-Modi-Yogi or support for something specific?",1
5913,1427616740205149952,https://www.boomlive.in/fact-check/afghanistan-aircraft-afghans-flee-taliban-viral-video-digital-creation-14341,Video shows an Afghan national lying on the wing of a flying aircraft.,1
5949,1419024250460160000,https://www.boomlive.in/fact-check/fact-check-tokyo-olympics-surya-namaskar-viral-video-old-mongolia-yoga-event-video-14022,Video shows people are doing Surya Namaskar in Tokyo Olympics.,1
5986,1389151321475980032,https://www.altnews.in/video-of-reliance-stickers-installed-on-oxygen-tankers-viral-with-false-claim/,Oxygen sent from Saudi Arabia is being distributed in the name of Reliance,1
5988,1443866646343409920,https://www.boomlive.in/fact-check/fake-news-republic-tv-zee-hindustan-pakistan-airstrikes-panjshir-valley-taliban-afghanistan-arma-3-video-game-factcheck-14582,Footage shows airstrikes in Panjshir valley by Pakistani airforce,1
6010,1393220931359630080,https://www.boomlive.in/fact-check/fake-news-viral-photo-ganga-river-dead-bodies-2015-photo-covid-19-bihar-buxar-factcheck-13126,"Recent photo shows dead bodies floating in the Ganga near Buxar, Bihar",1
6016,1430910171094540032,https://www.boomlive.in/fact-check/fake-news-viral-video-indian-army-jawans-mamun-military-station-pathankot-collapsed-heat-endurance-traning-covid19-vaccine-factcheck-14469,Video shows after the Indian army vaccinated its troops many of them dropped dead,1
6018,1395245778675790080,https://www.boomlive.in/fact-check/fake-news-viral-video-palastine-israel-kerala-muslims-qatar-grand-mosque-doha-wayanad-factcheck-13223,Clip shows Pro-Palestine protest in Keralas Wayanad,1
6028,1436531078127180032,https://www.boomlive.in/fact-check/movie-scene-falsely-shared-as-taliban-torturing-panjshir-locals-14682,Video shows the Taliban locking up Afghan nationals in Panjshir in shipping containers,1
6030,1436664481090840064,https://www.boomlive.in/fact-check/movie-scene-falsely-shared-as-taliban-torturing-panjshir-locals-14682,Video shows the Taliban locking up Afghan nationals in Panjshir in shipping containers,1
6035,1433086136662980096,https://www.boomlive.in/fact-check/old-video-afghan-corona-pandemic-afghanistan-pakistan-border-viral-false-claim-14522,Video shows Afghans are entering into Pakistan after the Taliban takeover.,1
6036,1433112835282769920,https://www.boomlive.in/fact-check/old-video-afghan-corona-pandemic-afghanistan-pakistan-border-viral-false-claim-14522,Video shows Afghans are entering into Pakistan after the Taliban takeover.,1
6060,1455120597055259904,https://www.boomlive.in/fact-check/politics/fake-news-maharashtra-navnirman-sena-diwali-program-shivaji-park-viral-video-eid-lighting-technical-mistake-dadar-mumbai-factcheck-15409,"Video shows Chhatrapati Shivaji Park in Dadar, Mumbai has Eid wishes in decorative lighting",1
6067,1447520704107200000,https://www.boomlive.in/fact-check/politics/fake-news-viral-video-2012-us-veterans-discarding-service-medals-no-nato-no-war-afghanistan-protest-factcheck-15100,"Video shows 40,000 US soldiers who fought in Afghanistan and Iraq, resigned and threw away their war medals",1
6095,1455607809945400064,https://www.boomlive.in/fact-check/politics/viral-video-police-chanting-hindu-slogan-tripura-riot-old-video-15353,"Video shows Tripura Police is leading the rioters to burn mosques, Muslims houses and their shops.",1
6097,1475419018441880064,https://www.boomlive.in/fact-check/politics/viral-video-reddy-tirupati-temple-donation-robbery-case-vellore-tamil-nadu-unrelated-16203,Video shows Income Tax officers recovered crores of cash and gold from Tirumala Tirupati Devasthanams board member J. Sekhar Reddy.,1
6108,1394237092180290048,https://www.boomlive.in/fact-check/saudi-arabia-clip-shared-as-cyclone-tauktae-destruction-at-mumbais-trident-hotel-13166,"Video shows aftermath of Cyclone Tauktae in Hotel Trident, Nariman Point",1
6157,1427238729005949952,https://www.boomlive.in/have-upa-era-oil-bonds-prevented-modi-govt-from-reducing-oil-prices/,Modi Govt Has Paid Back UPA-era Oil Bonds Of Rs 1.3 Lakh Crore,1
6184,1458804736610739968,https://www.boomlive.in/world/fake-news-covid-19-vaccine-stampede-south-africa-children-dead-15536,Video shows children who died after receiving COVID-19 vaccine.,1
6214,1467780967750269952,https://www.factchecker.in/fact-check/factcheck-have-fuel-prices-increased-due-to-oil-bonds-issued-by-upa-756951,Hike in fuel prices because of oil bonds issued by United Progressive Alliance (UPA) government,1
6220,1414165080220960000,https://www.factchecker.in/fact-check/factcheck-have-fuel-prices-increased-due-to-oil-bonds-issued-by-upa-756951,Hike in fuel prices because of oil bonds issued by United Progressive Alliance (UPA) government,1
6232,1431552073032600064,https://www.indiatoday.in/fact-check/story/fact-check-did-nostradamus-predict-the-coronavirus-pandemic-in-16th-century-1696567-2020-07-03,"French astrologer Nostradamus had predicted the outbreak of coronavirus in his book “Les Prophéties”.
",1
6306,1416748152967859968,https://www.indiatoday.in/fact-check/story/fact-check-france-has-not-banned-unvaccinated-people-from-purchasing-food-at-supermarkets-1828670-2021-07-15,"Come August 1, people in France will not be allowed to purchase food from supermarkets unless they are vaccinated.",1
6307,1428417768098080000,https://www.indiatoday.in/fact-check/story/fact-check-france-has-not-banned-unvaccinated-people-from-purchasing-food-at-supermarkets-1828670-2021-07-15,"Come August 1, people in France will not be allowed to purchase food from supermarkets unless they are vaccinated.",1
6347,1364177023413839872,https://www.indiatoday.in/fact-check/story/fact-check-these-are-not-rss-workers-dragged-through-the-streets-of-kerala-by-popular-front-1771333-2021-02-20,Video shows RSS workers in chains being marched through the streets of Kerala by Popular Front of India (PFI) activists.,1
6368,1394991284037639936,https://www.indiatoday.in/fact-check/story/fact-check-viral-clipping-of-ht-newspaper-claiming-pm-modi-missing-is-fake-1802729-2021-05-14,Hindustan Times published a classified advertisement about PM Modi gone missing.,1
6377,1456988483050889984,https://www.indiatoday.in/fact-check/story/fact-check-was-pm-modi-wearing-shoes-inside-kedarnath-temple-1532187-2019-05-22,PM Modi entered the Kedarnath temple in shoes.,1
6392,1432316551982579968,https://www.indiatoday.in/fact-check/story/taliban-unsc-terror-organisations-list-india-fact-check-1847321-2021-08-31,The United Nations Security Council has removed Taliban from the list of terror groups. It has recognised Taliban as an entity to drive forward the political process. This at a time Narendra Modi is presiding over UNSC.,1
6425,1405114467470309888,https://www.boomlive.in/fact-check/pm-modi-two-covid-vaccines-made-in-india-fact-check-13447,India has two made in India vaccines that are currently being given to its citizens,1
6430,1348127886369200128,https://www.boomlive.in/fact-check/fact-check-fake-news-balakot-zafar-hilaly-ani-india-today-surgical-strike-300-deaths-pakistan-narendra-modi-11487,Former Pak diplomat admits 300 casualties in Balakot airstrike by India,1
6457,1362660716667269888,https://www.boomlive.in/fact-check/false-claims-go-viral-about-patanjalis-coronil-approved-by-who-12061,Coronil certified by WHO as coronavirus treatment,1
6476,1380776709465740032,https://www.boomlive.in/fact-check/fake-news-locket-chatterjee-car-broken-from-inside-west-bengal-elections-bjp-tmc-voting-factcheck-12704,BJP leader Locket Chatterjees car window broken from inside,1
6516,1451879713257890048,https://www.boomlive.in/fact-check/world/viral-video-kolkata-west-bengal-bangladesh-violence-false-claim-15255,Video shows hundreds of Muslims are shouting to stop puja at a Kali Mata temple in Kolkata.,1
6519,1453609233799280128,https://www.boomlive.in/fact-check/fugitive-diamond-businessman-nirav-modi-arrest-london-court-statement-bjp-india-fake-news-13431,Nirav Modi says in Londin court that he did not flee India but was expelled and BJP leaders took a share for it.,1
6525,1468547484683160064,https://www.boomlive.in/fact-check/video-from-syria-peddled-as-fatal-crash-that-killed-cds-bipin-rawat-15932,Video shows how General Bipin Rawats helicopter crashed,1
6618,1379767913322700032,https://www.altnews.in/chhattisgarh-youth-congres-uses-morphed-image-to-accuse-bjp-the-news-is-real-but-one-year-old/,BJP leader arrested in connected with recent Maoist attack in Bijapur,1
6636,1388474740495450112,https://www.altnews.in/video-of-reliance-stickers-installed-on-oxygen-tankers-viral-with-false-claim/,Reliance taking credit for oxygen supplied by Saudi Arabia,1
6664,1390715319476440064,https://www.altnews.in/video-of-reliance-stickers-installed-on-oxygen-tankers-viral-with-false-claim/,Reliance taking credit for oxygen supplied by Saudi Arabia,1
6736,1430861940302109952,https://www.altnews.in/old-video-from-karnataka-shared-amid-protests-by-hindu-groups-in-ujjain/,Hindu groups take out rally in Ujjain against 'Pakistan Zindabad' slogans raised,1
6740,1436985171429890048,https://www.altnews.in/media-falsely-reports-ramayana-mahabharata-to-be-taught-in-saudi-arabian-schools/,Ramayana and Mahabharata will be taught in Saudi Arabia,1
6753,1445638749791030016,https://www.altnews.in/ankit-das-owner-of-second-car-in-lakhimpur-incident-is-a-bjp-supporter/,Congress leader was in the Fortuner that ran over farmers in Lakhimpur,1
6766,1450828100367840000,https://www.altnews.in/prakash-javadekar-shares-8-month-old-video-as-govt-supplying-coal-amid-recent-shortage/,Video of 4 km long rack train with 4 engines running to supply coal to power plants,1
6828,1397738643943419904,https://www.vishvasnews.com/english/world/fact-check-old-video-of-boris-johnson-shopping-as-common-citizen-shared-as-recent/,Boris came as a common citizen and caught doing shopping during the time of Corona Outbreak,1
6829,1324715876487059968,https://www.altnews.in/bjps-himanta-biswa-media-falsely-claim-pakistan-zindabad-slogans-raised-by-aiudf-supporters/,'Pakistan zindabad' slogans raised while welcoming AIUDF chief Maulana Badruddin Ajmal at Silchar airport,1
6858,1324594390703160064,https://www.altnews.in/bjps-himanta-biswa-media-falsely-claim-pakistan-zindabad-slogans-raised-by-aiudf-supporters/,'Pakistan zindabad' slogans raised while welcoming AIUDF chief Maulana Badruddin Ajmal at Silchar airport,1
6974,1499222228826670080,https://www.altnews.in/mea-denies-russia-stopped-war-for-6-hours-at-indias-behest/,Russia stopped war for six hours for India to students to evacuate safely,1
7031,1500421127176270080,https://www.altnews.in/staged-video-shared-as-bihar-groom-refuses-to-marry-due-to-dowry/,Bihar groom refusing to marry if not given dowry,1
7070,1488721017530830080,https://www.altnews.in/video-from-thane-falsely-viral-as-muslim-woman-preventing-flag-hoisting-on-r-day/,Muslim woman in Maharashtra blocking flag hoisting and snatching Bharat Mata's photo on Republic Day,1
7072,1488577548149979904,https://www.altnews.in/video-from-thane-falsely-viral-as-muslim-woman-preventing-flag-hoisting-on-r-day/,Muslim woman in Maharashtra blocking flag hoisting and snatching Bharat Mata's photo on Republic Day,1
7109,1491004781489700096,https://www.boomlive.in/fact-check/politics/karnataka-national-flag-replaced-with-saffron-flag-replaces-indian-flag-shivamogga-karnataka-hijab-row-factcheck-16683,"Video shows National flag being replaced with saffron flag in Shivamogga, Karnataka",1
7117,1328905032775859968,https://www.boomlive.in/fake-news/2014-video-shared-as-hindu-chants-recited-at-white-house-for-joe-biden-10735,Video showing vedic chants recited at White House on first working  day of US President Joe Biden,1
7147,1210903611548600064,https://www.altnews.in/no-anti-caa-protesters-did-not-chant-pakistan-zindabad-in-lucknow-rally/,'Pakistan zindabad' slogan raised by anti-CAA protesters in Lucknow rally,1
